"Disease","OPCS4code","OPCS4codeDescr"
"Glaucoma","C65","Operations following glaucoma surgery"
"Glaucoma","C65.1","Needling of bleb"
"Glaucoma","C65.2","Injection of bleb"
"Glaucoma","C65.3","Revision of bleb NEC"
"Glaucoma","C65.4","Removal of releasable suture following glaucoma surgery"
"Glaucoma","C65.5","Laser suture lysis following glaucoma surgery"
"Glaucoma","C65.8","Other specified operations following glaucoma surgery"
"Glaucoma","C65.9","Unspecified operations following glaucoma surgery"
"Glaucoma","C82.1","Cauterisation of lesion of retina"
