Condition,ICD10code,ICD10codeDescr
Myelodysplastic syndromes,D46,Myelodysplastic syndromes
Myelodysplastic syndromes,D46.0,"Refractory anaemia without ring sideroblasts, so stated"
Myelodysplastic syndromes,D46.1,Refractory anaemia with ring sideroblasts
Myelodysplastic syndromes,D46.2,Refractory anaemia with excess of blasts [RAEB]
Myelodysplastic syndromes,D46.4,"Refractory anaemia, unspecified"
Myelodysplastic syndromes,D46.5,Refractory anaemia with multi-lineage dysplasia
Myelodysplastic syndromes,D46.6,Myelodysplastic syndrome with isolated del(5q) chromosomal abnormality
Myelodysplastic syndromes,D46.9,"Myelodysplastic syndrome, unspecified"
