Disease,ICD10code,ICD10codeDescr
Primary malignancy liver,C22.0,Malignant neoplasm: Liver cell carcinoma
Primary malignancy liver,C22.2,Malignant neoplasm: Hepatoblastoma
Primary malignancy liver,C22.3,Malignant neoplasm: Angiosarcoma of liver
Primary malignancy liver,C22.4,Malignant neoplasm: Other sarcomas of liver
Primary malignancy liver,C22.7,Malignant neoplasm: Other specified carcinomas of liver
Primary malignancy liver,C22.9,Malignant neoplasm: Liver unspecified
Primary malignancy liver,C22.9,"Malignant neoplasm: Liver, unspecified"
Primary malignancy liver,D37.6,"Neoplasm of uncertain or unknown behaviour: Liver, gallbladder and bile ducts"
