Disease,OPCS4code,OPCS4codeDescr
"Non-malignant tumour of brain, central nervous system and pituitary",B04,Other operations on pituitary gland
"Non-malignant tumour of brain, central nervous system and pituitary",B04.1,Excision of lesion of pituitary gland
"Non-malignant tumour of brain, central nervous system and pituitary",B04.3,Decompression of pituitary gland
"Non-malignant tumour of brain, central nervous system and pituitary",B04.4,Exploration of pituitary gland
"Non-malignant tumour of brain, central nervous system and pituitary",B04.8,Other specified other operations on pituitary gland
"Non-malignant tumour of brain, central nervous system and pituitary",B04.9,Unspecified other operations on pituitary gland
Obesity,G28.4,Sleeve gastrectomy and duodenal switch
Obesity,G28.5,Sleeve gastrectomy NEC
Obesity,G30.2,Partitioning of stomach NEC
Obesity,G30.3,Partitioning of stomach using band
Obesity,G30.4,Partitioning of stomach using staples
Obesity,G30.5,Maintenance of gastric band
Obesity,G31.2,Bypass of stomach by anastomosis of stomach to duodenum
Obesity,G33.1,Bypass of stomach by anastomosis of stomach to jejunum NEC
Obesity,G38.7,Removal of gastric band
Obesity,G61,Bypass of jejunum
Obesity,G61.1,Bypass of jejunum by anastomosis of jejunum to jejunum
Obesity,G61.2,Bypass of jejunum by anastomosis of jejunum to ileum
Obesity,G61.3,Bypass of jejunum by anastomosis of jejunum to colon
Obesity,G61.8,Other specified bypass of jejunum
Obesity,G61.9,Unspecified bypass of jejunum
Obesity,G71.6,Duodenal switch
Osteoarthritis (excl spine),U50.5,Delivery of rehabilitation for osteoarthritis
Other psychoactive substance misuse,U52.1,Delivery of rehabilitation for drug addiction
Peptic ulcer disease,G29.2,Open excision of lesion of stomach NEC
Peptic ulcer disease,G29.8,Other specified open extirpation of lesion of stomach
Peptic ulcer disease,G35,Operations on ulcer of stomach
Peptic ulcer disease,G35.1,Closure of perforated ulcer of stomach
Peptic ulcer disease,G35.2,Closure of ulcer of stomach NEC
Peptic ulcer disease,G35.8,Other specified operations on ulcer of stomach
Peptic ulcer disease,G35.9,Unspecified operations on ulcer of stomach
Peptic ulcer disease,G52,Operations on ulcer of duodenum
Peptic ulcer disease,G52.1,Closure of perforated ulcer of duodenum
Peptic ulcer disease,G52.2,Suture of ulcer of duodenum NEC
Peptic ulcer disease,G52.3,Oversew of blood vessel of duodenal ulcer
Peptic ulcer disease,G52.8,Other specified operations on ulcer of duodenum
Peptic ulcer disease,G52.9,Unspecified operations on ulcer of duodenum
Peripheral arterial disease,L16.3,Bypass of aorta by anastomosis of axillary artery to bilateral femoral arteries
Peripheral arterial disease,L16.2,Bypass of aorta by anastomosis of axillary artery to femoral artery NEC
Peripheral arterial disease,L21,Other bypass of segment of aorta
Peripheral arterial disease,L21.8,Other specified other bypass of segment of aorta
Peripheral arterial disease,L21.6,Bypass of bifurcation of aorta by anastomosis of aorta to iliac artery NEC
Peripheral arterial disease,L21.9,Unspecified other bypass of segment of aorta
Peripheral arterial disease,L25.3,Open embolectomy of bifurcation of aorta
Peripheral arterial disease,L51,Other bypass of iliac artery
Peripheral arterial disease,L50.8,Other specified other emergency bypass of iliac artery
Peripheral arterial disease,L51.8,Other specified other bypass of iliac artery
Peripheral arterial disease,L59.1,Bypass of femoral artery by anastomosis of femoral artery to femoral artery NEC
Peripheral arterial disease,L51.6,Bypass of artery of leg by anastomosis of iliac artery to femoral artery NEC
Peripheral arterial disease,L51.9,Unspecified other bypass of iliac artery
Peripheral arterial disease,L52,Reconstruction of iliac artery
Peripheral arterial disease,L52.1,Endarterectomy of iliac artery and patch repair of iliac artery
Peripheral arterial disease,L52.2,Endarterectomy of iliac artery NEC
Peripheral arterial disease,L52.8,Other specified reconstruction of iliac artery
Peripheral arterial disease,L52.9,Unspecified reconstruction of iliac artery
Peripheral arterial disease,L53,Other open operations on iliac artery
Peripheral arterial disease,L53.1,Repair of iliac artery NEC
Peripheral arterial disease,L53.2,Open embolectomy of iliac artery
Peripheral arterial disease,L54.1,Percutaneous transluminal angioplasty of iliac artery
Peripheral arterial disease,L54.2,Percutaneous transluminal embolectomy of iliac artery
Peripheral arterial disease,L54.4,Percutaneous transluminal insertion of stent into iliac artery
Peripheral arterial disease,L54.8,Other specified transluminal operations on iliac artery
Peripheral arterial disease,L54.9,Unspecified transluminal operations on iliac artery
Peripheral arterial disease,L58,Other emergency bypass of femoral artery
Peripheral arterial disease,L59,Other bypass of femoral artery
Peripheral arterial disease,L59.9,Unspecified other bypass of femoral artery
Peripheral arterial disease,L60,Reconstruction of femoral artery
Peripheral arterial disease,L60.2,Endarterectomy of femoral artery NEC
Peripheral arterial disease,L60.4,Profundoplasty of femoral artery NEC
Peripheral arterial disease,L60.8,Other specified reconstruction of femoral artery
Peripheral arterial disease,L60.9,Unspecified reconstruction of femoral artery
Peripheral arterial disease,L62,Other open operations on femoral artery
Peripheral arterial disease,L62.1,Repair of femoral artery NEC
Peripheral arterial disease,L62.2,Open embolectomy of femoral artery
Peripheral arterial disease,L63.1,Percutaneous transluminal angioplasty of femoral artery
Peripheral arterial disease,L63.2,Percutaneous transluminal embolectomy of femoral artery
Peripheral arterial disease,L63.3,Percutaneous transluminal embolisation of femoral artery
Peripheral arterial disease,L65,Revision of reconstruction of artery
Peripheral arterial disease,L65.1,Revision of reconstruction involving aorta
Peripheral arterial disease,L65.2,Revision of reconstruction involving iliac artery
Peripheral arterial disease,L65.3,Revision of reconstruction involving femoral artery
Peripheral arterial disease,L65.8,Other specified revision of reconstruction of artery
Peripheral venous and lymphatic disease,L83.2,Subfascial ligation of perforating vein of leg
Peripheral venous and lymphatic disease,L85,Ligation of varicose vein of leg
Peripheral venous and lymphatic disease,L85.3,Ligation of recurrent varicose vein of leg
Peripheral venous and lymphatic disease,L85.8,Other specified ligation of varicose vein of leg
Peripheral venous and lymphatic disease,L85.9,Unspecified ligation of varicose vein of leg
Peripheral venous and lymphatic disease,L86,Injection into varicose vein of leg
Peripheral venous and lymphatic disease,L86.1,Injection of sclerosing substance into varicose vein of leg NEC
Peripheral venous and lymphatic disease,L87.7,Transilluminated powered phlebectomy of varicose vein of leg
Peripheral venous and lymphatic disease,L86.8,Other specified injection into varicose vein of leg
Peripheral venous and lymphatic disease,L86.9,Unspecified injection into varicose vein of leg
Peripheral venous and lymphatic disease,L87,Other operations on varicose vein of leg
Peripheral venous and lymphatic disease,L87.5,Local excision of varicose vein of leg
Peripheral venous and lymphatic disease,L87.6,Incision of varicose vein of leg
Peripheral venous and lymphatic disease,L87.8,Other specified other operations on varicose vein of leg
Peripheral venous and lymphatic disease,L87.9,Unspecified other operations on varicose vein of leg
Peripheral venous and lymphatic disease,L84,Combined operations on varicose vein of leg
Peripheral venous and lymphatic disease,L84.8,Other specified combined operations on varicose vein of leg
Peripheral venous and lymphatic disease,L84.9,Unspecified combined operations on varicose vein of leg
Peripheral venous and lymphatic disease,L88,Transluminal operations on varicose vein of leg
Peripheral venous and lymphatic disease,L88.2,Radiofrequency ablation of varicose vein of leg
Peripheral venous and lymphatic disease,L88.8,Other specified transluminal operations on varicose vein of leg
Peripheral venous and lymphatic disease,L88.9,Unspecified transluminal operations on varicose vein of leg
Peripheral venous and lymphatic disease,T92,Other operations on lymphatic tissue
Peripheral venous and lymphatic disease,T92.2,Excision of lymphoedematous tissue of arm
Peripheral venous and lymphatic disease,T92.3,Excision of lymphoedematous tissue of leg and buried flaps HFQ
Peripheral venous and lymphatic disease,T92.4,Excision of lymphoedematous tissue of leg NEC
Peripheral venous and lymphatic disease,T92.5,Excision of lymphoedematous tissue of scrotum
Peripheral venous and lymphatic disease,T92.6,Excision of lymphoedematous tissue NEC
Peripheral venous and lymphatic disease,T92.8,Other specified other operations on lymphatic tissue
Portal hypertension and oesophageal varices,G10,Open operations on varices of oesophagus
Portal hypertension and oesophageal varices,G10.4,Local ligation of varices of oesophagus
Portal hypertension and oesophageal varices,G10.5,Open injection sclerotherapy to varices of oesophagus
Portal hypertension and oesophageal varices,G10.8,Other specified open operations on varices of oesophagus
Portal hypertension and oesophageal varices,G10.9,Unspecified open operations on varices of oesophagus
Portal hypertension and oesophageal varices,G14.8,Other specified fibreoptic endoscopic extirpation of lesion of oesophagus
Portal hypertension and oesophageal varices,G17.8,Other specified endoscopic extirpation of lesion of oesophagus using rigid oesophagoscope
Primary malignancy malignant melanoma,S06.9,Unspecified other excision of lesion of skin
Primary malignancy prostate,M34.8,Other specified total excision of bladder
Primary malignancy prostate,M34.1,Cystoprostatectomy
Primary malignancy prostate,M61.1,Total excision of prostate and capsule of prostate
Primary Malignancy_Other Skin and subcutaneous tissue,S06.9,Unspecified other excision of lesion of skin
Ptosis of eyelid,C18,Correction of ptosis of eyelid
Ptosis of eyelid,C18.3,Correction of ptosis of eyelid using sling of fascia
Ptosis of eyelid,C18.6,Correction of ptosis of eyelid using aponeurosis technique
Ptosis of eyelid,C18.8,Other specified correction of ptosis of eyelid
Ptosis of eyelid,C18.9,Unspecified correction of ptosis of eyelid
Retinal detachments and breaks,C81,Photocoagulation of retina for detachment
Retinal detachments and breaks,C81.1,Xenon photocoagulation of retina for detachment
Retinal detachments and breaks,C81.2,Laser photocoagulation of retina for detachment
Retinal detachments and breaks,C81.8,Other specified photocoagulation of retina for detachment
Retinal detachments and breaks,C81.9,Unspecified photocoagulation of retina for detachment
Rheumatoid Arthritis,U50.4,Delivery of rehabilitation for rheumatoid arthritis
Scoliosis,V41.2,Anterior attachment of correctional instrument to spine
Spina bifida,A12.2,Creation of ventriculovascular shunt
Spina bifida,A49,Repair of spina bifida
Spina bifida,A49.2,Closure of spinal myelomeningocele
Spina bifida,A49.3,Closure of spinal meningocele
Spina bifida,A49.8,Other specified repair of spina bifida
Spina bifida,A49.9,Unspecified repair of spina bifida
Spondylolisthesis,V38.3,Primary posterior fusion of joint of lumbar spine NEC
Spondylolisthesis,V43.8,Other specified extirpation of lesion of spine
Spondylolisthesis,V54.8,Other specified other operations on spine
Subdural haematoma,A41.1,Evacuation of subdural haematoma
Subdural haematoma,A41,Drainage of subdural space
Subdural haematoma,A41.8,Other specified drainage of subdural space
Subdural haematoma,A41.9,Unspecified drainage of subdural space
Thyroid disease,B08,Excision of thyroid gland
Thyroid disease,B08.1,Total thyroidectomy
Thyroid disease,B08.2,Subtotal thyroidectomy
Thyroid disease,B08.9,Unspecified excision of thyroid gland
Thyroid disease,B08.8,Other specified excision of thyroid gland
Thyroid disease,B12.8,Other specified other operations on thyroid gland
Thyroid disease,B12.9,Unspecified other operations on thyroid gland
Urinary Incontinence,M75.2,Insertion of prosthesis for compression of bulb of male urethra
Urolithiasis,M06.1,Open removal of calculus from kidney
Urolithiasis,M09,Therapeutic endoscopic operations on calculus of kidney
Urolithiasis,M09.1,Endoscopic ultrasound fragmentation of calculus of kidney
Urolithiasis,M09.3,Endoscopic laser fragmentation of calculus of kidney
Urolithiasis,M09.4,Endoscopic extraction of calculus of kidney NEC
Urolithiasis,M09.8,Other specified therapeutic endoscopic operations on calculus of kidney
Urolithiasis,M09.9,Unspecified therapeutic endoscopic operations on calculus of kidney
Urolithiasis,M14.1,Extracorporeal shock wave lithotripsy of calculus of kidney
Urolithiasis,M14.9,Unspecified extracorporeal fragmentation of calculus of kidney
Urolithiasis,M26.1,Nephroscopic laser fragmentation of calculus of ureter
Urolithiasis,M26.2,Nephroscopic fragmentation of calculus of ureter NEC
Urolithiasis,M26.3,Nephroscopic extraction of calculus of ureter
Urolithiasis,M27.3,Ureteroscopic extraction of calculus of ureter
Urolithiasis,M27.1,Ureteroscopic laser fragmentation of calculus of ureter
Urolithiasis,M27.2,Ureteroscopic fragmentation of calculus of ureter NEC
Urolithiasis,M28,Other endoscopic removal of calculus from ureter
Urolithiasis,M28.1,Code retired - refer to introduction
Urolithiasis,M28.2,Code retired - refer to introduction
Urolithiasis,M28.3,Code retired - refer to introduction
Urolithiasis,M28.4,Endoscopic catheter drainage of calculus of ureter
Urolithiasis,M28.5,Endoscopic drainage of calculus of ureter by dilation of ureter
Urolithiasis,M28.8,Other specified other endoscopic removal of calculus from ureter
Urolithiasis,M28.9,Unspecified other endoscopic removal of calculus from ureter
Urolithiasis,M31.1,Extracorporeal shockwave lithotripsy of calculus of ureter
Urolithiasis,M86.1,Endoscopic extraction of calculus of urinary diversion
Urolithiasis,M39.1,Open removal of calculus from bladder
Urolithiasis,M44.2,Endoscopic extraction of calculus of bladder NEC
Urolithiasis,M44.1,Endoscopic lithopaxy
Urolithiasis,M47.8,Other specified urethral catheterisation of bladder
Urolithiasis,M75.4,Open extraction of calculus from urethra
Urolithiasis,M75.9,Unspecified other open operations on urethra
Urolithiasis,M76.2,Endoscopic removal of foreign body from urethra
Vitamin B12 deficiency anaemia,X37.8,Other specified intramuscular injection
